<t:root xmlns:t="test"
        xmlns:o="other"
        xmlns:xsi="http://www.w3.org/2001/XMLSchema-instance"
        xsi:schemaLocation="test test.xsd">

  <!-- fail e maxOccurs="2" -->
  <sequence>
    <c>c</c>
    <d>d</d>
    <t:any>any</t:any>
    <f>f</f>
    <e>e</e>
    <e>e</e>
    <e>e</e>
  </sequence>

</t:root>
